<?xml version="1.0" encoding="utf-8"?>
<xs:schema xmlns:xs="http://www.w3.org/2001/XMLSchema">
    <xs:element name="Games">
        <xs:complexType>
            <xs:sequence>
                <xs:element name="Game" maxOccurs="unbounded">
                    <xs:complexType>
                        <xs:sequence>
                            <xs:element name="PlayerName" type="xs:string"/>
                            <xs:element name="GameDate" type="xs:dateTime"/>
                            <xs:element name="Score" type="xs:int"/>
                        </xs:sequence>
                    </xs:complexType>
                </xs:element>
            </xs:sequence>
        </xs:complexType>
    </xs:element>
</xs:schema>
